{
  "approvals": {
    "gate_a": {
      "approver": "product-owner",
      "at": "2026-08-25T15:19:18.872409+00:00",
      "direction": "E",
      "gate": "gate_a",
      "state_revision": 16,
      "status": "approved"
    }
  },
  "artifacts": {
    "canonical:01-today": {
      "generated_at": "2026-08-25T15:27:36.407707+00:00",
      "id": "canonical:01-today",
      "kind": "external",
      "path": "10-canonical-validation/canonical-screens/01-today.html",
      "phase": "canonical_validation",
      "producer": "codex.local-authoring",
      "sha256": "c5fb6a225f5c9faa666a731d3b28fe10b5400efce9f1d9b5145cb8cc03730118",
      "status": "current"
    },
    "canonical:02-log-meal": {
      "generated_at": "2026-08-25T15:27:36.487072+00:00",
      "id": "canonical:02-log-meal",
      "kind": "external",
      "path": "10-canonical-validation/canonical-screens/02-log-meal.html",
      "phase": "canonical_validation",
      "producer": "codex.local-authoring",
      "sha256": "0759c2f1077c64419fbbf19ba07da4eefb8810da447395346a1e55c49eef2348",
      "status": "current"
    },
    "canonical:03-food-details": {
      "generated_at": "2026-08-25T15:27:36.567081+00:00",
      "id": "canonical:03-food-details",
      "kind": "external",
      "path": "10-canonical-validation/canonical-screens/03-food-details.html",
      "phase": "canonical_validation",
      "producer": "codex.local-authoring",
      "sha256": "26cdf839c93482a95e4d5e88e767ebed4ddeea7d54208d33993d9580902058f5",
      "status": "current"
    },
    "canonical:04-habitat": {
      "generated_at": "2026-08-25T15:27:36.645693+00:00",
      "id": "canonical:04-habitat",
      "kind": "external",
      "path": "10-canonical-validation/canonical-screens/04-habitat.html",
      "phase": "canonical_validation",
      "producer": "codex.local-authoring",
      "sha256": "00331d222a7b33466120d7b17ea17a16686b62648fc9de869bca7028c1b58a0e",
      "status": "current"
    },
    "canonical:05-progress": {
      "generated_at": "2026-08-25T15:27:36.724904+00:00",
      "id": "canonical:05-progress",
      "kind": "external",
      "path": "10-canonical-validation/canonical-screens/05-progress.html",
      "phase": "canonical_validation",
      "producer": "codex.local-authoring",
      "sha256": "e5b323a53f983980dd29d4a0b0862ab1e3d23ca6e54fcf9d61b4fda1f2c2d27e",
      "status": "current"
    },
    "completeness-json": {
      "generated_at": "2026-08-25T15:27:36.249360+00:00",
      "id": "completeness-json",
      "kind": "external",
      "path": "10-canonical-validation/completeness-matrix.json",
      "phase": "canonical_validation",
      "producer": "codex.local-authoring",
      "sha256": "67a827a3b588ce465d7c7bc3a139e4aed2c06839af0a07257fd8543ad0247cc6",
      "status": "current"
    },
    "completeness-matrix-md": {
      "generated_at": "2026-08-25T15:27:36.167996+00:00",
      "id": "completeness-matrix-md",
      "kind": "external",
      "path": "COMPLETENESS_MATRIX.md",
      "phase": "canonical_validation",
      "producer": "codex.local-authoring",
      "sha256": "55db59eb0100debdeaf982a07474a91ebb3e9cde0baf4ec6fc6677584dfe0754",
      "status": "current"
    },
    "component-api-md": {
      "generated_at": "2026-08-25T15:22:47.897537+00:00",
      "id": "component-api-md",
      "kind": "external",
      "path": "COMPONENT_API.md",
      "phase": "components",
      "producer": "codex.local-authoring",
      "sha256": "95d76f72ae0b853b56cc3c62398e1d5588869652ee15313b5f958d0bfaff920f",
      "status": "current"
    },
    "components": {
      "generated_at": "2026-08-25T15:22:47.979916+00:00",
      "id": "components",
      "kind": "external",
      "path": "07-components/components.json",
      "phase": "components",
      "producer": "codex.local-authoring",
      "sha256": "fb87291f4985b7cd081f600704689da94ee9826f3d908648bcd9292f33321a72",
      "status": "current"
    },
    "components-md": {
      "generated_at": "2026-08-25T15:22:47.815015+00:00",
      "id": "components-md",
      "kind": "external",
      "path": "COMPONENTS.md",
      "phase": "components",
      "producer": "codex.local-authoring",
      "sha256": "7c119fc76c9b22e1c5063426de89d064294dcef25abb3440e4397aedc74a31e3",
      "status": "current"
    },
    "cross-platform-parity-md": {
      "generated_at": "2026-08-25T15:23:43.303033+00:00",
      "id": "cross-platform-parity-md",
      "kind": "external",
      "path": "CROSS_PLATFORM_PARITY.md",
      "phase": "implementation",
      "producer": "codex.local-authoring",
      "sha256": "9272343c42a7432bec1490352dc41cbc46de120adedfd99548219f03c807b280",
      "status": "current"
    },
    "decisions": {
      "generated_at": "2026-08-25T15:18:35.647493+00:00",
      "id": "decisions",
      "kind": "external",
      "path": "DESIGN_DECISIONS.md",
      "phase": "interview",
      "producer": "codex.local-authoring",
      "sha256": "ed027f3ce9dfd24fdb4572f3f9bfcd952b8b0faafe13e2098805fc4d0faaab75",
      "status": "current"
    },
    "directions": {
      "generated_at": "2026-08-25T15:18:35.958127+00:00",
      "id": "directions",
      "kind": "external",
      "path": "03-directions/directions.html",
      "phase": "directions",
      "producer": "codex.local-authoring",
      "sha256": "2fe4767d6a4b7e4062180b275abacd9d5dd9f7d30e0f8f54bbfa2421031ce4ed",
      "status": "current"
    },
    "directions-json": {
      "generated_at": "2026-08-25T15:19:18.708472+00:00",
      "id": "directions-json",
      "kind": "external",
      "path": "03-directions/directions.json",
      "phase": "directions",
      "producer": "codex.local-authoring",
      "sha256": "21eb33509c489dd0952465d89a52147b9dfc9f8fe5e2dbe632da859183756bd5",
      "status": "current"
    },
    "directions-md": {
      "generated_at": "2026-08-25T15:18:35.881580+00:00",
      "id": "directions-md",
      "kind": "external",
      "path": "DIRECTIONS.md",
      "phase": "directions",
      "producer": "codex.local-authoring",
      "sha256": "291079b36307148933c8a092f5640b65047ef619077d4e463e53db1e4af945f3",
      "status": "current"
    },
    "gap-log-json": {
      "generated_at": "2026-08-25T15:27:36.328525+00:00",
      "id": "gap-log-json",
      "kind": "external",
      "path": "gap_log.json",
      "phase": "canonical_validation",
      "producer": "codex.local-authoring",
      "sha256": "34f44cb2966e6ea9e678146ecca718d66b58fd20bb93f7bf0e241feaf988a81b",
      "status": "current"
    },
    "implementation-compose": {
      "generated_at": "2026-08-25T15:23:43.539543+00:00",
      "id": "implementation-compose",
      "kind": "external",
      "path": "08-implementation/compose/Components.kt",
      "phase": "implementation",
      "producer": "codex.local-authoring",
      "sha256": "981ac1000086115152ed6e85cbb9ccbb3be8d7549551384318ed95af7f479c4f",
      "status": "current"
    },
    "implementation-mapping-md": {
      "generated_at": "2026-08-25T15:23:43.220075+00:00",
      "id": "implementation-mapping-md",
      "kind": "external",
      "path": "IMPLEMENTATION_MAPPING.md",
      "phase": "implementation",
      "producer": "codex.local-authoring",
      "sha256": "d126b8a7abfa222390f2f95ddd8228bcf75c15d198cad2e485fd69a486c9347d",
      "status": "current"
    },
    "implementation-swiftui": {
      "generated_at": "2026-08-25T15:23:43.461483+00:00",
      "id": "implementation-swiftui",
      "kind": "external",
      "path": "08-implementation/swiftui/Components.swift",
      "phase": "implementation",
      "producer": "codex.local-authoring",
      "sha256": "a031f7d0bb2a377ca7013d0dc24e08ee76d064080f74015edcc2af5d6d478387",
      "status": "current"
    },
    "implementation-web": {
      "generated_at": "2026-08-25T15:23:43.383038+00:00",
      "id": "implementation-web",
      "kind": "external",
      "path": "08-implementation/web/components.html",
      "phase": "implementation",
      "producer": "codex.local-authoring",
      "sha256": "3a6e4b4cf72b8a0e4822ed8c2bd609981cfdd5a741c4e23aacbad85eecde8f9b",
      "status": "current"
    },
    "interaction-baseline": {
      "generated_at": "2026-08-25T15:20:53.898469+00:00",
      "id": "interaction-baseline",
      "kind": "external",
      "path": "interaction_baseline.json",
      "phase": "baselines",
      "producer": "codex.local-authoring",
      "sha256": "1c000437472b71e7593f1f31f46b9fa720b052612d2c18b1b78609c7f1a664ad",
      "status": "current"
    },
    "interaction-baseline-md": {
      "generated_at": "2026-08-25T15:20:53.820661+00:00",
      "id": "interaction-baseline-md",
      "kind": "external",
      "path": "INTERACTION_BASELINE.md",
      "phase": "baselines",
      "producer": "codex.local-authoring",
      "sha256": "5f65e25fcae8affc9bb9c07b60019d6fc14fd163d4a293f759a92e9382e17c47",
      "status": "current"
    },
    "language": {
      "generated_at": "2026-08-25T15:21:08.140227+00:00",
      "id": "language",
      "kind": "external",
      "path": "DESIGN_LANGUAGE.md",
      "phase": "language",
      "producer": "codex.local-authoring",
      "sha256": "148f30d0a309e9d0561743afdcc75965b8e87927729d059fc0fa1c104cb1b34f",
      "status": "current"
    },
    "motion-playground-spec-md": {
      "generated_at": "2026-08-25T15:25:34.349882+00:00",
      "id": "motion-playground-spec-md",
      "kind": "external",
      "path": "MOTION_PLAYGROUND_SPEC.md",
      "phase": "playground",
      "producer": "codex.local-authoring",
      "sha256": "4e906ede4d1bda8c1c6c75adb5066421e830538402a239f7e9fee53fdf5b474d",
      "status": "current"
    },
    "playground": {
      "generated_at": "2026-08-25T15:25:34.509446+00:00",
      "id": "playground",
      "kind": "external",
      "path": "09-playground/components/index.html",
      "phase": "playground",
      "producer": "codex.local-authoring",
      "sha256": "8c5c289236d5cdf6b7d0c4c5265d4df13413b7d832f517b459a0c1249599dd85",
      "status": "current"
    },
    "playground-spec-md": {